{
    "schema_version": 1,
    "key": "official.article",
    "version": "1.0.0",
    "source": {
        "type": "canonical-contents",
        "reference": "canonical-plugin-contents-v1",
        "sha256": "f473f54eef2ab57b25f7ffc7baa054e6105c29422a2e176365a38860f630d8b4"
    },
    "composer": [
        {
            "name": "peanut-business/official-article",
            "version": "1.0.0",
            "sha256": "0d70212c546a2fa7b190f9ca77a5854eeadf9edad1e98b6da5285dd0172d4fc3"
        }
    ],
    "npm": [
        {
            "name": "@peanut-admin/official-article",
            "version": "1.0.0",
            "integrity": "sha256-CT2Az249M0CTRSj6jltMKXQbSFSGjzapYLbHFkwv/GU="
        }
    ],
    "frontend": [
        {
            "client_key": "admin-web",
            "package": "@peanut-admin/official-article",
            "version": "1.0.0",
            "entry": "web/src/modules/official-article/contribution.ts",
            "sha256": "3b4f605ea7ef0b52e6474128977dca4882ed1b941b9979bd5d445b5c596ed9ef"
        }
    ],
    "modules": [
        {
            "key": "official.article",
            "root": "server/app/Modules/Official/Article"
        }
    ]
}
