{
    "schema_version": 1,
    "key": "official.member",
    "version": "1.0.0",
    "source": {
        "type": "canonical-contents",
        "reference": "canonical-plugin-contents-v1",
        "sha256": "7aafb390642098ddf86736c1c5ef50c29a04c91e3fd52b8844965f4a759c9be7"
    },
    "composer": [
        {
            "name": "peanut-business/official-member",
            "version": "1.0.0",
            "sha256": "0a538f5cf95e17a1efd90021e4d8f5a15e78ec560dad8a333eeccf81f2dacb28"
        }
    ],
    "npm": [
        {
            "name": "@peanut-admin/official-member",
            "version": "1.0.0",
            "integrity": "sha256-Kv1fy2fUFatnFibRWmtrz1kfSWo39FWZzVVtkZBaaTU="
        }
    ],
    "frontend": [
        {
            "client_key": "admin-web",
            "package": "@peanut-admin/official-member",
            "version": "1.0.0",
            "entry": "web/src/modules/official-member/contribution.ts",
            "sha256": "757c6dbd637a8f4569b585f1eca16c8ef8cb1493322af4591925c5d6765bb24f"
        }
    ],
    "modules": [
        {
            "key": "official.member",
            "root": "server/app/Modules/Official/Member"
        }
    ]
}
