{
    "schema_version": 1,
    "key": "official.file",
    "version": "1.0.0",
    "source": {
        "type": "canonical-contents",
        "reference": "canonical-plugin-contents-v1",
        "sha256": "61ab4f1eb5c1a24a3b4186a05196854d42753dc53f06f99618c99291b3d17094"
    },
    "composer": [
        {
            "name": "peanut-business/official-file",
            "version": "1.0.0",
            "sha256": "043318630579ada2787d74812f26851880645dff846da30b464127e3c2b5c73f"
        }
    ],
    "npm": [
        {
            "name": "@peanut-admin/official-file",
            "version": "1.0.0",
            "integrity": "sha256-VJBlYTJu2a1z2wX9eVJjdUR+G6g8BHc4m32h8PVc05c="
        }
    ],
    "frontend": [
        {
            "client_key": "admin-web",
            "package": "@peanut-admin/official-file",
            "version": "1.0.0",
            "entry": "web/src/modules/official-file/contribution.ts",
            "sha256": "088e59645ed33ad61179694feb01fddea811c68cd349173d10b37c77eabfebe6"
        }
    ],
    "modules": [
        {
            "key": "official.file",
            "root": "server/app/Modules/Official/File"
        }
    ]
}
