{
    "schema_version": 1,
    "key": "official.oauth",
    "version": "1.0.0",
    "source": {
        "type": "canonical-contents",
        "reference": "canonical-plugin-contents-v1",
        "sha256": "ca5e49bbc1d7669c205823fd3839352963ce4a33d81163a0ac86d8b13ab48ac6"
    },
    "composer": [
        {
            "name": "peanut-business/official-oauth",
            "version": "1.0.0",
            "sha256": "e8577c132ae507fb50e7705482041003704166ab3bb71ab4d54a458af7d3cf7e"
        }
    ],
    "npm": [
        {
            "name": "@peanut-admin/official-oauth",
            "version": "1.0.0",
            "integrity": "sha256-KcwPmbz1lUGOl9fhRrt1EQHjZcSR/H2XzSSb4UFBos0="
        }
    ],
    "frontend": [
        {
            "client_key": "admin-web",
            "package": "@peanut-admin/official-oauth",
            "version": "1.0.0",
            "entry": "web/src/modules/official-oauth/contribution.ts",
            "sha256": "8b01e630a0e9ae493e73247c83228fa3d958a7043626fbfd319fa314c3a302dc"
        }
    ],
    "modules": [
        {
            "key": "official.oauth",
            "root": "server/app/Modules/Official/Oauth"
        }
    ]
}
