{
    "schema_version": 1,
    "key": "official.task",
    "version": "1.0.0",
    "source": {
        "type": "canonical-contents",
        "reference": "canonical-plugin-contents-v1",
        "sha256": "6e0a3b20b3a4e9a34f03f599f153a286b1cefd66bdbd04a13394bf08b6199543"
    },
    "composer": [
        {
            "name": "peanut-business/official-task",
            "version": "1.0.0",
            "sha256": "3b2d16697434351c4edf9f987eec1aaea54918a82ad195f22620068e2a1e88a7"
        }
    ],
    "npm": [
        {
            "name": "@peanut-admin/official-task",
            "version": "1.0.0",
            "integrity": "sha256-RlQfi7KX5G07JRTdw65GgHyVQsVhopuB0BujNdEAdfs="
        }
    ],
    "frontend": [
        {
            "client_key": "admin-web",
            "package": "@peanut-admin/official-task",
            "version": "1.0.0",
            "entry": "web/src/modules/official-task/contribution.ts",
            "sha256": "2b9aa10f964240aba01a577038c7eee34ea4a3ed7c6347589d86c33685309b4e"
        }
    ],
    "modules": [
        {
            "key": "official.task",
            "root": "server/app/Modules/Official/Task"
        }
    ]
}
