{
    "schema_version": 1,
    "key": "official.notification",
    "version": "1.0.0",
    "source": {
        "type": "canonical-contents",
        "reference": "canonical-plugin-contents-v1",
        "sha256": "b5baa1407633a5a00122c07d13f04b09897cda4ccd4cd4f834d710532da90215"
    },
    "composer": [
        {
            "name": "peanut-business/official-notification",
            "version": "1.0.0",
            "sha256": "da92474a54dfd9786389ddbc6125b0148f675de833694f63d56dd243bc56fd1f"
        }
    ],
    "npm": [
        {
            "name": "@peanut-admin/official-notification",
            "version": "1.0.0",
            "integrity": "sha256-qDKZuyRkhB9NsrIW6uRBjdpWWIPN+A4/D78zdin38yA="
        }
    ],
    "frontend": [
        {
            "client_key": "admin-web",
            "package": "@peanut-admin/official-notification",
            "version": "1.0.0",
            "entry": "web/src/modules/official-notification/contribution.ts",
            "sha256": "72ca5d2d5f8a67b69fa9cc5e04c93520cb8ce8ac3a647930d069bf5950d44f48"
        }
    ],
    "modules": [
        {
            "key": "official.notification",
            "root": "server/app/Modules/Official/Notification"
        }
    ]
}
