{
    "schema_version": 1,
    "key": "official.payment",
    "version": "1.0.0",
    "source": {
        "type": "canonical-contents",
        "reference": "canonical-plugin-contents-v1",
        "sha256": "e0efeb701b0070315bef3fcf13529bece19a0dcfbd5acb1c70052ec56fecfbec"
    },
    "composer": [
        {
            "name": "peanut-business/official-payment",
            "version": "1.0.0",
            "sha256": "f9dd52e52b5828d0471320979904053beb909e2ebca19e6821be497133f7743a"
        }
    ],
    "npm": [
        {
            "name": "@peanut-admin/official-payment",
            "version": "1.0.0",
            "integrity": "sha256-/1flqNwzAK2An9Vt6JLnzG0KsNScKDhMYT/pl/xtCZM="
        }
    ],
    "frontend": [
        {
            "client_key": "admin-web",
            "package": "@peanut-admin/official-payment",
            "version": "1.0.0",
            "entry": "web/src/modules/official-payment/contribution.ts",
            "sha256": "242654524ab2c3e7ea23e70b5d2de494f12c09a2f58b608107f821bb4777afdf"
        }
    ],
    "modules": [
        {
            "key": "official.payment",
            "root": "server/app/Modules/Official/Payment"
        }
    ]
}
