{
    "schema_version": 1,
    "key": "official.file",
    "version": "1.0.0",
    "source": {
        "type": "canonical-contents",
        "reference": "canonical-plugin-contents-v1",
        "sha256": "5a0bb606a237b68ea64a922babf6ce85a796d0c265ad0845b41333e62e8ad20b"
    },
    "composer": [
        {
            "name": "peanut-business/official-file",
            "version": "1.0.0",
            "sha256": "10979da8db2e35f62efbf3d03da7e7ee5802cf527cab22ccde42afaf3c9390e5"
        }
    ],
    "npm": [
        {
            "name": "@peanut-admin/official-file",
            "version": "1.0.0",
            "integrity": "sha256-VJBlYTJu2a1z2wX9eVJjdUR+G6g8BHc4m32h8PVc05c="
        }
    ],
    "frontend": [
        {
            "client_key": "admin-web",
            "package": "@peanut-admin/official-file",
            "version": "1.0.0",
            "entry": "web/src/modules/official-file/contribution.ts",
            "sha256": "eb5ac2e76f2f30859062df53942872b09b31d5c607d61e6766c0fbbe066aa207"
        }
    ],
    "modules": [
        {
            "key": "official.file",
            "root": "server/app/Modules/Official/File"
        }
    ]
}
