{
    "schema_version": 1,
    "key": "official.import-export",
    "version": "1.0.0",
    "source": {
        "type": "canonical-contents",
        "reference": "canonical-plugin-contents-v1",
        "sha256": "44b6a3063a3865930d85d4177d959b15154e77f63eba85e2a3b3daa56c17f88d"
    },
    "composer": [
        {
            "name": "peanut-business/official-import-export",
            "version": "1.0.0",
            "sha256": "4ed5a098e3c6fe7a090ce2c080543efaaa0120fdb653d22b3dbb50f332a6de8a"
        }
    ],
    "npm": [
        {
            "name": "@peanut-admin/official-import-export",
            "version": "1.0.0",
            "integrity": "sha256-R9TS3d25osrNOc2blxMZXley5F1wK+pTGxkMkxgHsZQ="
        }
    ],
    "frontend": [
        {
            "client_key": "admin-web",
            "package": "@peanut-admin/official-import-export",
            "version": "1.0.0",
            "entry": "web/src/modules/official-import-export/contribution.ts",
            "sha256": "993ec2cc0f80309284a1b6e5d1c498383c9e9e5e3a132bb137a9deb25e673a68"
        }
    ],
    "modules": [
        {
            "key": "official.import-export",
            "root": "server/app/Modules/Official/ImportExport"
        }
    ]
}
